{
  "$schema": "https://json-schema.org/draft/2020-12/schema",
  "type": "object",
  "properties": {
    "$schema": {
      "type": "string"
    },
    "schemaVersion": {
      "type": "string",
      "const": "1"
    },
    "meta": {
      "type": "object",
      "properties": {
        "generatedAt": {
          "type": "string",
          "format": "date-time",
          "pattern": "^(?:(?:\\d\\d[2468][048]|\\d\\d[13579][26]|\\d\\d0[48]|[02468][048]00|[13579][26]00)-02-29|\\d{4}-(?:(?:0[13578]|1[02])-(?:0[1-9]|[12]\\d|3[01])|(?:0[469]|11)-(?:0[1-9]|[12]\\d|30)|(?:02)-(?:0[1-9]|1\\d|2[0-8])))T(?:(?:[01]\\d|2[0-3]):[0-5]\\d:[0-5]\\d(?:\\.\\d+)?(?:Z))$"
        },
        "generator": {
          "type": "object",
          "properties": {
            "name": {
              "type": "string",
              "minLength": 1
            },
            "version": {
              "type": "string",
              "minLength": 1
            }
          },
          "required": [
            "name",
            "version"
          ],
          "additionalProperties": false
        },
        "repo": {
          "type": "object",
          "properties": {
            "name": {
              "type": "string",
              "minLength": 1
            },
            "commit": {
              "type": "string",
              "pattern": "^[0-9a-f]{7,40}$"
            }
          },
          "required": [
            "name"
          ],
          "additionalProperties": false
        },
        "frameworks": {
          "default": [],
          "type": "array",
          "items": {
            "type": "string",
            "minLength": 1
          }
        }
      },
      "required": [
        "generatedAt",
        "generator",
        "repo"
      ],
      "additionalProperties": false
    },
    "nodes": {
      "type": "array",
      "items": {
        "type": "object",
        "properties": {
          "id": {
            "type": "string",
            "minLength": 1,
            "pattern": "^\\S+$"
          },
          "kind": {
            "type": "string",
            "enum": [
              "ui-event",
              "timer",
              "route",
              "ws-endpoint",
              "sse-endpoint",
              "middleware",
              "handler",
              "service",
              "worker",
              "database",
              "cache",
              "queue",
              "topic",
              "external-api",
              "unknown"
            ]
          },
          "label": {
            "type": "string",
            "minLength": 1
          },
          "evidence": {
            "minItems": 1,
            "type": "array",
            "items": {
              "type": "object",
              "properties": {
                "file": {
                  "type": "string",
                  "minLength": 1
                },
                "line": {
                  "type": "integer",
                  "exclusiveMinimum": 0,
                  "maximum": 9007199254740991
                },
                "endLine": {
                  "type": "integer",
                  "exclusiveMinimum": 0,
                  "maximum": 9007199254740991
                },
                "snippet": {
                  "type": "string",
                  "maxLength": 500
                }
              },
              "required": [
                "file",
                "line"
              ],
              "additionalProperties": false
            }
          },
          "confidence": {
            "type": "string",
            "enum": [
              "verified",
              "inferred",
              "unresolved"
            ]
          },
          "source": {
            "default": "parser",
            "type": "string",
            "enum": [
              "parser",
              "llm",
              "manual"
            ]
          },
          "concepts": {
            "default": [],
            "type": "array",
            "items": {
              "type": "string",
              "pattern": "^[a-z0-9]+(-[a-z0-9]+)*$"
            }
          },
          "props": {
            "default": {},
            "type": "object",
            "propertyNames": {
              "type": "string"
            },
            "additionalProperties": {}
          }
        },
        "required": [
          "id",
          "kind",
          "label",
          "evidence",
          "confidence"
        ],
        "additionalProperties": false
      }
    },
    "edges": {
      "default": [],
      "type": "array",
      "items": {
        "type": "object",
        "properties": {
          "id": {
            "type": "string",
            "minLength": 1,
            "pattern": "^\\S+$"
          },
          "from": {
            "type": "string",
            "minLength": 1,
            "pattern": "^\\S+$"
          },
          "to": {
            "type": "string",
            "minLength": 1,
            "pattern": "^\\S+$"
          },
          "protocol": {
            "type": "string",
            "enum": [
              "in-process",
              "http",
              "ws",
              "sse",
              "grpc",
              "sql",
              "mongodb",
              "redis",
              "amqp",
              "kafka",
              "unknown"
            ]
          },
          "lifecycle": {
            "type": "string",
            "enum": [
              "none",
              "new-per-request",
              "pooled",
              "persistent",
              "unknown"
            ]
          },
          "mode": {
            "type": "string",
            "enum": [
              "sync",
              "async"
            ]
          },
          "label": {
            "type": "string",
            "minLength": 1
          },
          "evidence": {
            "minItems": 1,
            "type": "array",
            "items": {
              "type": "object",
              "properties": {
                "file": {
                  "type": "string",
                  "minLength": 1
                },
                "line": {
                  "type": "integer",
                  "exclusiveMinimum": 0,
                  "maximum": 9007199254740991
                },
                "endLine": {
                  "type": "integer",
                  "exclusiveMinimum": 0,
                  "maximum": 9007199254740991
                },
                "snippet": {
                  "type": "string",
                  "maxLength": 500
                }
              },
              "required": [
                "file",
                "line"
              ],
              "additionalProperties": false
            }
          },
          "confidence": {
            "type": "string",
            "enum": [
              "verified",
              "inferred",
              "unresolved"
            ]
          },
          "source": {
            "default": "parser",
            "type": "string",
            "enum": [
              "parser",
              "llm",
              "manual"
            ]
          },
          "concepts": {
            "default": [],
            "type": "array",
            "items": {
              "type": "string",
              "pattern": "^[a-z0-9]+(-[a-z0-9]+)*$"
            }
          },
          "props": {
            "default": {},
            "type": "object",
            "propertyNames": {
              "type": "string"
            },
            "additionalProperties": {}
          }
        },
        "required": [
          "id",
          "from",
          "to",
          "protocol",
          "lifecycle",
          "mode",
          "evidence",
          "confidence"
        ],
        "additionalProperties": false
      }
    },
    "flows": {
      "default": [],
      "type": "array",
      "items": {
        "type": "object",
        "properties": {
          "id": {
            "type": "string",
            "minLength": 1,
            "pattern": "^\\S+$"
          },
          "label": {
            "type": "string",
            "minLength": 1
          },
          "entry": {
            "type": "string",
            "minLength": 1,
            "pattern": "^\\S+$"
          },
          "steps": {
            "minItems": 1,
            "type": "array",
            "items": {
              "type": "object",
              "properties": {
                "edge": {
                  "type": "string",
                  "minLength": 1,
                  "pattern": "^\\S+$"
                },
                "note": {
                  "type": "string",
                  "minLength": 1
                }
              },
              "required": [
                "edge"
              ],
              "additionalProperties": false
            }
          }
        },
        "required": [
          "id",
          "label",
          "entry",
          "steps"
        ],
        "additionalProperties": false
      }
    },
    "findings": {
      "default": [],
      "type": "array",
      "items": {
        "type": "object",
        "properties": {
          "id": {
            "type": "string",
            "minLength": 1,
            "pattern": "^\\S+$"
          },
          "rule": {
            "type": "string",
            "pattern": "^[a-z0-9]+(-[a-z0-9]+)*$"
          },
          "severity": {
            "type": "string",
            "enum": [
              "info",
              "low",
              "medium",
              "high"
            ]
          },
          "title": {
            "type": "string",
            "minLength": 1
          },
          "consequence": {
            "type": "string",
            "minLength": 1
          },
          "concept": {
            "type": "string",
            "pattern": "^[a-z0-9]+(-[a-z0-9]+)*$"
          },
          "refs": {
            "default": [],
            "type": "array",
            "items": {
              "type": "string",
              "minLength": 1,
              "pattern": "^\\S+$"
            }
          },
          "evidence": {
            "minItems": 1,
            "type": "array",
            "items": {
              "type": "object",
              "properties": {
                "file": {
                  "type": "string",
                  "minLength": 1
                },
                "line": {
                  "type": "integer",
                  "exclusiveMinimum": 0,
                  "maximum": 9007199254740991
                },
                "endLine": {
                  "type": "integer",
                  "exclusiveMinimum": 0,
                  "maximum": 9007199254740991
                },
                "snippet": {
                  "type": "string",
                  "maxLength": 500
                }
              },
              "required": [
                "file",
                "line"
              ],
              "additionalProperties": false
            }
          }
        },
        "required": [
          "id",
          "rule",
          "severity",
          "title",
          "consequence",
          "evidence"
        ],
        "additionalProperties": false
      }
    },
    "gaps": {
      "default": [],
      "type": "array",
      "items": {
        "type": "object",
        "properties": {
          "id": {
            "type": "string",
            "minLength": 1,
            "pattern": "^\\S+$"
          },
          "refs": {
            "minItems": 1,
            "type": "array",
            "items": {
              "type": "string",
              "minLength": 1,
              "pattern": "^\\S+$"
            }
          },
          "reason": {
            "type": "string",
            "minLength": 1
          },
          "evidence": {
            "minItems": 1,
            "type": "array",
            "items": {
              "type": "object",
              "properties": {
                "file": {
                  "type": "string",
                  "minLength": 1
                },
                "line": {
                  "type": "integer",
                  "exclusiveMinimum": 0,
                  "maximum": 9007199254740991
                },
                "endLine": {
                  "type": "integer",
                  "exclusiveMinimum": 0,
                  "maximum": 9007199254740991
                },
                "snippet": {
                  "type": "string",
                  "maxLength": 500
                }
              },
              "required": [
                "file",
                "line"
              ],
              "additionalProperties": false
            }
          }
        },
        "required": [
          "id",
          "refs",
          "reason",
          "evidence"
        ],
        "additionalProperties": false
      }
    }
  },
  "required": [
    "schemaVersion",
    "meta",
    "nodes"
  ],
  "additionalProperties": false,
  "$id": "urn:vibesimulator:trace-spec:v1",
  "title": "vibeSimulator Trace Spec v1"
}
